{
  "schemaVersion": 1,
  "project": "gary-ui-visual-engine-samples",
  "outputRoot": "outputs",
  "visuals": [
    {
      "id": "architecture",
      "title": "系统架构图",
      "description": "组件、边界、主路径与异步分支。",
      "purpose": "architecture",
      "tool": "archify",
      "source": "sources/architecture.json",
      "scene": "analysis",
      "theme": "dark",
      "quality": "showcase",
      "formats": ["html", "svg", "png", "pdf"],
      "citation": {"label": "Archify 示例结构", "url": "https://github.com/tt-a1i/archify", "note": "示例拓扑，不代表真实系统"}
    },
    {
      "id": "workflow-with-exception",
      "title": "含异常分支的流程图",
      "description": "正常路径、审批阻断、重试与证据记录。",
      "purpose": "workflow",
      "tool": "archify",
      "source": "sources/workflow-with-exception.json",
      "scene": "analysis",
      "theme": "dark",
      "quality": "showcase",
      "formats": ["html", "svg", "png"],
      "citation": {"label": "Archify 示例结构", "url": "https://github.com/tt-a1i/archify", "note": "示例流程，不代表真实运行记录"}
    },
    {
      "id": "sequence",
      "title": "缓存回退时序图",
      "description": "身份校验、缓存未命中、数据库回源与异步追踪。",
      "purpose": "sequence",
      "tool": "archify",
      "source": "sources/sequence.json",
      "scene": "analysis",
      "theme": "light",
      "quality": "showcase",
      "formats": ["html", "svg", "png"],
      "citation": {"label": "Archify 示例结构", "url": "https://github.com/tt-a1i/archify", "note": "示例时序，不代表真实请求"}
    },
    {
      "id": "data-flow",
      "title": "产品分析数据流",
      "description": "来源、采集、同意边界、仓库与消费端。",
      "purpose": "data-flow",
      "tool": "archify",
      "source": "sources/data-flow.json",
      "scene": "analysis",
      "theme": "dark",
      "quality": "showcase",
      "formats": ["html", "svg", "png"],
      "citation": {"label": "Archify 示例结构", "url": "https://github.com/tt-a1i/archify", "note": "示例数据流，不代表真实业务"}
    },
    {
      "id": "lifecycle",
      "title": "Agent 运行生命周期",
      "description": "活动状态、等待、恢复路径与终止状态。",
      "purpose": "lifecycle",
      "tool": "archify",
      "source": "sources/lifecycle.json",
      "scene": "showcase",
      "theme": "dark",
      "quality": "showcase",
      "formats": ["html", "svg", "png"],
      "citation": {"label": "Archify 示例结构", "url": "https://github.com/tt-a1i/archify", "note": "示例状态机，不代表真实任务"}
    },
    {
      "id": "quantitative",
      "title": "定量趋势与缺失值",
      "description": "真实刻度、单位、系列形状、缺失值和数据表替代。",
      "purpose": "quantitative",
      "tool": "echarts",
      "source": "sources/quantitative.json",
      "scene": "analysis",
      "theme": "dark",
      "formats": ["html", "svg", "png", "pdf"],
      "citation": {"label": "Gary-UI 明确示例数据", "url": null, "note": "仅用于版式和导出验收"}
    },
    {
      "id": "research-outline",
      "title": "中文研究提纲",
      "description": "Markdown 原生源，可折叠、缩放并保留层级。",
      "purpose": "outline",
      "tool": "markmap",
      "source": "sources/research-outline.md",
      "scene": "reading",
      "theme": "light",
      "formats": ["html", "svg", "png", "pdf"],
      "citation": {"label": "Gary-UI 示例提纲", "url": null, "note": "示例内容，无外部事实主张"}
    },
    {
      "id": "summary-infographic",
      "title": "步骤摘要信息图",
      "description": "精选模板承载步骤与摘要，不替代定量刻度。",
      "purpose": "infographic",
      "tool": "antv-infographic",
      "source": "sources/summary-infographic.json",
      "scene": "showcase",
      "theme": "dark",
      "formats": ["html", "svg", "png", "pdf"],
      "citation": {"label": "Gary-UI 示例流程", "url": null, "note": "示例信息图，无真实评分或百分比"}
    },
    {
      "id": "simple-flow",
      "title": "Markdown 内简单流程",
      "description": "保留 Mermaid 源，并提示复杂关系显式转 Archify。",
      "purpose": "simple-flow",
      "tool": "mermaid",
      "source": "sources/simple-flow.mmd",
      "scene": "reading",
      "theme": "light",
      "formats": ["html", "svg", "png"],
      "citation": {"label": "Gary-UI 示例流程", "url": null, "note": "用于验证 Mermaid 文档内渲染"}
    },
    {
      "id": "icons",
      "title": "Lucide 操作图标",
      "description": "固定名称、24px viewBox、1.75 线宽与可访问名称。",
      "purpose": "icons",
      "tool": "lucide",
      "source": "sources/icons.json",
      "scene": "analysis",
      "theme": "dark",
      "formats": ["html", "svg", "png"],
      "citation": {"label": "Lucide 图标集", "url": "https://lucide.dev/", "note": "ISC 许可，名称来自锁定版本"}
    }
  ]
}
